{
  "$schema": "http://json-schema.org/draft-07/schema#",
  "id": "kickup_training_program_001",
  "name": "Kick Up Beginner Training Program",
  "description": "A beginner-friendly progression for learning the kick-up with mobility, bridge strength, core control, and safe explosive practice.",
  "exercises": [
    {
      "id": "ex_tuck_roll_back",
      "name": "Tuck Roll Back",
      "description": "Practice rolling backward with a rounded spine and tucked chin to learn safe momentum control.",
      "execution_notes": "Roll back smoothly, keep your chin tucked, and return to the start with control.",
      "category": "Mobility",
      "muscle_groups": ["Core", "Spine", "Neck"],
      "difficulty": "Beginner",
      "equipment": [],
      "duration_secs": 0,
      "sets": 3,
      "reps_min": 5,
      "reps_max": 8,
      "is_unilateral": false,
      "rest_secs": 30,
      "video_url": "https://www.youtube.com/watch?v=oMUKM-Q1MHg&t=44s",
      "image_url": "kickup_tuck_roll_back.png"
    },
    {
      "id": "ex_shoulder_bridge_hold",
      "name": "Shoulder Bridge Hold",
      "description": "Build extension and shoulder support for the kick-up.",
      "execution_notes": "Place hands near your ears, lift hips and chest, and hold a stable bridge position.",
      "category": "Strength",
      "muscle_groups": ["Glutes", "Hamstrings", "Shoulders", "Back"],
      "difficulty": "Beginner",
      "equipment": [],
      "duration_secs": 20,
      "sets": 4,
      "reps_min": null,
      "reps_max": null,
      "is_unilateral": false,
      "rest_secs": 30,
      "video_url": "https://www.youtube.com/watch?v=HWXD0JbwT-w&t=20s",
      "image_url": "kickup_shoulder_bridge_hold.png"
    },
    {
      "id": "ex_bridge_push",
      "name": "Bridge Push",
      "description": "Explode lightly through the shoulders and arms from a bridge position.",
      "execution_notes": "From bridge, press the floor away and create a small lift without collapsing the elbows.",
      "category": "Power",
      "muscle_groups": ["Shoulders", "Triceps", "Core", "Back"],
      "difficulty": "Beginner",
      "equipment": [],
      "duration_secs": 0,
      "sets": 3,
      "reps_min": 5,
      "reps_max": 8,
      "is_unilateral": false,
      "rest_secs": 45,
      "video_url": "https://www.youtube.com/watch?v=oMUKM-Q1MHg&t=156s",
      "image_url": "kickup_bridge_push.png"
    },
    {
      "id": "ex_hip_thrust_kick",
      "name": "Hip Thrust Kick",
      "description": "Coordinate a quick leg drive with hip extension to build kick-up timing.",
      "execution_notes": "Kick one or both legs upward fast, then reset before the next rep.",
      "category": "Power",
      "muscle_groups": ["Hip Flexors", "Glutes", "Core"],
      "difficulty": "Beginner",
      "equipment": [],
      "duration_secs": 0,
      "sets": 4,
      "reps_min": 6,
      "reps_max": 10,
      "is_unilateral": false,
      "rest_secs": 30,
      "video_url": "https://www.youtube.com/watch?v=oMUKM-Q1MHg&t=184s",
      "image_url": "kickup_hip_thrust_kick.png"
    },
    {
      "id": "ex_hollow_body_hold",
      "name": "Hollow Body Hold",
      "description": "Strengthen core tension for better control during the kick-up.",
      "execution_notes": "Press your lower back into the floor, keep ribs down, and hold a tight shape.",
      "category": "Core",
      "muscle_groups": ["Core", "Hip Flexors"],
      "difficulty": "Beginner",
      "equipment": [],
      "duration_secs": 20,
      "sets": 4,
      "reps_min": null,
      "reps_max": null,
      "is_unilateral": false,
      "rest_secs": 30,
      "video_url": "https://www.youtube.com/watch?v=0yPin8hSc8o&t=0s",
      "image_url": "kickup_hollow_body_hold.png"
    },
    {
      "id": "ex_wall_kick_up",
      "name": "Wall Kick-Up",
      "description": "Practice kicking up to a wall to learn alignment and control.",
      "execution_notes": "Kick one leg up, bring the second leg with control, and tap the wall lightly without crashing.",
      "category": "Skill",
      "muscle_groups": ["Shoulders", "Core", "Glutes", "Hip Flexors"],
      "difficulty": "Beginner",
      "equipment": ["Wall"],
      "duration_secs": 0,
      "sets": 5,
      "reps_min": 3,
      "reps_max": 5,
      "is_unilateral": false,
      "rest_secs": 45,
      "video_url": "https://www.youtube.com/watch?v=x5A0pLArpkI&t=17s",
      "image_url": "kickup_wall_kick_up.png"
    },
    {
      "id": "ex_floor_kick_up_attempt",
      "name": "Floor Kick-Up Attempt",
      "description": "Attempt the full kick-up from the floor with controlled timing and a soft landing.",
      "execution_notes": "Start low, kick fast, push through the shoulders, and land softly in a squat or stable stand.",
      "category": "Skill",
      "muscle_groups": ["Core", "Shoulders", "Glutes", "Hip Flexors", "Hamstrings"],
      "difficulty": "Beginner",
      "equipment": [],
      "duration_secs": 0,
      "sets": 5,
      "reps_min": 3,
      "reps_max": 5,
      "is_unilateral": false,
      "rest_secs": 60,
      "video_url": "https://www.youtube.com/watch?v=HWXD0JbwT-w&t=105s",
      "image_url": "kickup_floor_attempt.png"
    }
  ]
}